{
  "$schema": "http://json-schema.org/draft-07/schema#",
  "$id": "https://salvageunion.io/schema/vehicles.schema.json",
  "title": "vehicles",
  "description": "Conventional vehicles",
  "type": "array",
  "items": {
    "$schema": "http://json-schema.org/draft-07/schema#",
    "type": "object",
    "properties": {
      "hasArtwork": {
        "type": "boolean",
        "description": "Whether this entity has artwork; the .webp URL is derived from schema + slug"
      },
      "content": {
        "type": "array",
        "items": {
          "description": "Block of structured content for rendering (paragraph, heading, list item, etc.)",
          "type": "object",
          "properties": {
            "type": {
              "default": "paragraph",
              "type": "string",
              "enum": [
                "paragraph",
                "heading",
                "list-item",
                "label",
                "datavalues",
                "hint",
                "flavor",
                "choice"
              ],
              "description": "Type of content block for rendering structured text"
            },
            "value": {
              "anyOf": [
                { "type": "string" },
                {
                  "type": "array",
                  "items": {
                    "type": "object",
                    "properties": {
                      "label": {
                        "anyOf": [{ "type": "string" }, { "type": "number" }],
                        "description": "Display label for this data value"
                      },
                      "value": {
                        "anyOf": [{ "type": "string" }, { "type": "number" }],
                        "description": "The data value"
                      },
                      "type": {
                        "type": "string",
                        "enum": ["keyword", "trait", "cost"],
                        "description": "Type classification for this data value"
                      },
                      "unit": {
                        "type": "string",
                        "description": "Optional unit shown after the value (e.g. damage type \"SP\")"
                      },
                      "perTechLevel": {
                        "type": "number",
                        "description": "When set, this numeric value scales with the entity's effective tech level: it increases by this amount for each tech level above the first (e.g. Custom Sniper Rifle damage \"+1 SP per Tech Level after the first\")"
                      }
                    },
                    "required": ["label"],
                    "additionalProperties": false,
                    "description": "A data value with label, optional value, optional type, optional unit, and optional per-tech-level scaling"
                  },
                  "description": "Array of data values when type is 'datavalues'"
                }
              ]
            },
            "label": { "type": "string" },
            "level": { "type": "integer", "minimum": 1, "maximum": 6 },
            "lead": { "type": "boolean" },
            "choiceId": {
              "type": "string",
              "description": "When type is \"choice\": the id of the entity choice to render inline at this position"
            },
            "items": {
              "type": "array",
              "items": {
                "type": "object",
                "properties": {
                  "type": {
                    "default": "paragraph",
                    "type": "string",
                    "enum": [
                      "paragraph",
                      "heading",
                      "list-item",
                      "label",
                      "datavalues",
                      "hint",
                      "flavor",
                      "choice"
                    ],
                    "description": "Type of content block for rendering structured text"
                  },
                  "value": {
                    "anyOf": [
                      { "type": "string" },
                      {
                        "type": "array",
                        "items": {
                          "type": "object",
                          "properties": {
                            "label": {
                              "anyOf": [{ "type": "string" }, { "type": "number" }],
                              "description": "Display label for this data value"
                            },
                            "value": {
                              "anyOf": [{ "type": "string" }, { "type": "number" }],
                              "description": "The data value"
                            },
                            "type": {
                              "type": "string",
                              "enum": ["keyword", "trait", "cost"],
                              "description": "Type classification for this data value"
                            },
                            "unit": {
                              "type": "string",
                              "description": "Optional unit shown after the value (e.g. damage type \"SP\")"
                            },
                            "perTechLevel": {
                              "type": "number",
                              "description": "When set, this numeric value scales with the entity's effective tech level: it increases by this amount for each tech level above the first (e.g. Custom Sniper Rifle damage \"+1 SP per Tech Level after the first\")"
                            }
                          },
                          "required": ["label"],
                          "additionalProperties": false,
                          "description": "A data value with label, optional value, optional type, optional unit, and optional per-tech-level scaling"
                        },
                        "description": "Array of data values when type is 'datavalues'"
                      }
                    ]
                  },
                  "label": { "type": "string" },
                  "level": { "type": "integer", "minimum": 1, "maximum": 6 }
                },
                "required": ["type"],
                "additionalProperties": false
              }
            }
          },
          "required": ["type"],
          "additionalProperties": false
        },
        "description": "Descriptive content blocks for this entity"
      },
      "id": { "type": "string", "description": "Unique identifier for this entity" },
      "blackMarket": {
        "type": "boolean",
        "description": "Whether this entity is only available on the black market"
      },
      "name": { "type": "string", "minLength": 1, "description": "Display name of this entity" },
      "source": {
        "type": "string",
        "enum": [
          "Salvage Union Workshop Manual",
          "Salvage Union Starter Set",
          "Reclamation of the Wastes",
          "The Hive",
          "Thatcher's Mech Base",
          "Relics of a Time Gone By",
          "Mech Monday",
          "We Were Here First!",
          "Rainmaker",
          "False Flag"
        ],
        "description": "Primary source book this entity appears in"
      },
      "page": {
        "type": "integer",
        "exclusiveMinimum": 0,
        "maximum": 9007199254740991,
        "description": "Page number in the primary source book"
      },
      "booklet": {
        "type": "string",
        "minLength": 1,
        "description": "Booklet code within a multi-booklet primary source (e.g. \"CR\", \"PH\", \"PC\", \"RR\", \"AP\" for the Salvage Union Starter Set). Omit for single-volume sources."
      },
      "additionalSources": {
        "type": "array",
        "items": {
          "type": "object",
          "properties": {
            "source": {
              "type": "string",
              "enum": [
                "Salvage Union Workshop Manual",
                "Salvage Union Starter Set",
                "Reclamation of the Wastes",
                "The Hive",
                "Thatcher's Mech Base",
                "Relics of a Time Gone By",
                "Mech Monday",
                "We Were Here First!",
                "Rainmaker",
                "False Flag"
              ],
              "description": "Secondary source book this entity also appears in"
            },
            "booklet": {
              "type": "string",
              "minLength": 1,
              "description": "Booklet code within a multi-booklet source (e.g. \"CR\", \"PH\", \"PC\", \"RR\", \"AP\" for the Salvage Union Starter Set — Core Rulebook / Pilots Handbook / Parts Catalogue / Rules Reference / Asset Pack). Omit for single-volume sources."
            },
            "page": {
              "type": "integer",
              "exclusiveMinimum": 0,
              "maximum": 9007199254740991,
              "description": "Page number in the secondary source book"
            }
          },
          "required": ["source", "page"],
          "additionalProperties": false,
          "description": "A secondary source where this entity is reprinted (e.g. condensed in a Starter Set)"
        },
        "description": "Other source books where this entity is reprinted"
      },
      "structurePoints": {
        "type": "integer",
        "minimum": 0,
        "maximum": 9007199254740991,
        "description": "Structure points (mech health)"
      },
      "techLevel": {
        "anyOf": [
          { "type": "integer", "minimum": 1, "maximum": 6 },
          { "type": "string", "const": "B" },
          { "type": "string", "const": "N" }
        ],
        "description": "Technology level of the item or entity (integer 1-6, 'B' for Bio, or 'N' for Nanite)"
      },
      "salvageValue": {
        "type": "integer",
        "minimum": 0,
        "maximum": 9007199254740991,
        "description": "Scrap value when salvaged"
      },
      "traits": {
        "type": "array",
        "items": {
          "type": "object",
          "properties": {
            "amount": {
              "anyOf": [
                {
                  "type": "integer",
                  "minimum": 0,
                  "maximum": 9007199254740991,
                  "description": "Non-negative integer (0 or greater)"
                },
                { "type": "string" }
              ],
              "description": "Numeric or variable amount for this trait"
            },
            "type": { "type": "string", "description": "Trait type identifier" }
          },
          "required": ["type"],
          "additionalProperties": false,
          "description": "Special traits and properties of items, systems, or abilities"
        },
        "description": "Traits and special properties"
      },
      "energyPoints": {
        "type": "integer",
        "minimum": 0,
        "maximum": 9007199254740991,
        "description": "Energy points for powering systems"
      },
      "heatCapacity": {
        "type": "integer",
        "minimum": 0,
        "maximum": 9007199254740991,
        "description": "Maximum heat before overheating"
      },
      "systemSlots": {
        "type": "integer",
        "minimum": 0,
        "maximum": 9007199254740991,
        "description": "Number of system slots available"
      },
      "moduleSlots": {
        "type": "integer",
        "minimum": 0,
        "maximum": 9007199254740991,
        "description": "Number of module slots available"
      },
      "cargoCapacity": {
        "type": "integer",
        "minimum": 0,
        "maximum": 9007199254740991,
        "description": "Cargo carrying capacity"
      },
      "actions": {
        "type": "array",
        "items": { "type": "string" },
        "description": "Action names this vehicle can perform"
      }
    },
    "required": ["id", "name", "source", "page"],
    "additionalProperties": false,
    "description": "Conventional vehicles"
  }
}
