[
  {
    "id": "c1d53d2d-9abd-4a72-8e78-2674eb7d7329",
    "source": "Salvage Union Workshop Manual",
    "name": "Power Loader",
    "actions": ["Locomotion System", "Rigging Arm (Vehicle)", "Rigging Arm (Vehicle)"],
    "techLevel": 1,
    "salvageValue": 1,
    "structurePoints": 1,
    "page": 292,
    "additionalSources": [{ "source": "Reclamation of the Wastes", "page": 103 }],
    "content": [
      {
        "type": "paragraph",
        "value": "A pneumatically powered heavy loader for moving cargo."
      }
    ]
  },
  {
    "id": "cc95bd31-30c2-4f47-b1b3-a881eb228c0d",
    "source": "Salvage Union Workshop Manual",
    "name": "Box Wheel",
    "actions": ["Locomotion System"],
    "traits": [
      {
        "type": "personnel capacity",
        "amount": 4
      },
      {
        "type": "wheeled"
      }
    ],
    "techLevel": 1,
    "salvageValue": 1,
    "structurePoints": 1,
    "hasArtwork": true,
    "page": 292,
    "additionalSources": [{ "source": "Reclamation of the Wastes", "page": 102 }],
    "content": [
      {
        "type": "paragraph",
        "value": "A four seater box wheel vehicle designed for recreational driving. Not a lot of these nowadays."
      }
    ]
  },
  {
    "id": "b31e45ef-412a-46ae-bf21-83ef01477199",
    "source": "Salvage Union Workshop Manual",
    "name": "Fighting Box Wheel",
    "actions": ["Locomotion System", ".50 Cal Machine Gun"],
    "traits": [
      {
        "type": "personnel capacity",
        "amount": 6
      },
      {
        "type": "wheeled"
      }
    ],
    "techLevel": 1,
    "salvageValue": 2,
    "structurePoints": 2,
    "page": 293,
    "content": [
      {
        "type": "paragraph",
        "value": "An improvised fighting vehicle, modified to carry heavy weaponry."
      }
    ]
  },
  {
    "id": "92f28dba-4b4b-4e4d-81f8-bc9e279d92f5",
    "source": "Salvage Union Workshop Manual",
    "name": "Armoured Box Wheel",
    "actions": ["Locomotion System", "30mm Autocannon"],
    "traits": [
      {
        "type": "personnel capacity",
        "amount": 18
      },
      {
        "type": "wheeled"
      }
    ],
    "techLevel": 2,
    "salvageValue": 3,
    "structurePoints": 4,
    "hasArtwork": true,
    "page": 293,
    "additionalSources": [{ "source": "Reclamation of the Wastes", "page": 102 }],
    "content": [
      {
        "type": "paragraph",
        "value": "An armoured, wheeled vehicle that carries personnel and provides fire support"
      }
    ]
  },
  {
    "id": "2ee55c7e-c8fb-406f-93f9-93a5b2a9ba37",
    "source": "Salvage Union Workshop Manual",
    "name": "Tank",
    "actions": ["Locomotion System", "120mm Cannon"],
    "techLevel": 3,
    "salvageValue": 4,
    "structurePoints": 6,
    "page": 293,
    "additionalSources": [{ "source": "Reclamation of the Wastes", "page": 102 }],
    "content": [
      {
        "type": "paragraph",
        "value": "A conventional tracked, armoured battle vehicle."
      }
    ]
  },
  {
    "id": "1e582dbd-3d2c-4408-a43c-d961ba63fb37",
    "source": "Salvage Union Workshop Manual",
    "name": "Rotorcraft",
    "actions": ["Hover Locomotion System", "Rotary Minigun"],
    "traits": [
      {
        "type": "personnel capacity",
        "amount": 6
      },
      {
        "type": "hover"
      }
    ],
    "techLevel": 4,
    "salvageValue": 3,
    "structurePoints": 3,
    "page": 293,
    "additionalSources": [{ "source": "Reclamation of the Wastes", "page": 102 }],
    "content": [
      {
        "type": "paragraph",
        "value": "A flying vehicle that can hover over terrain."
      }
    ]
  },
  {
    "id": "f4fe9598-04dd-4d00-b742-1ab7695b43cd",
    "source": "Reclamation of the Wastes",
    "page": 102,
    "name": "E-Boat",
    "actions": ["Integrated Amphibious Locomotion System"],
    "traits": [
      {
        "type": "personnel capacity",
        "amount": 12
      }
    ],
    "techLevel": 1,
    "salvageValue": 2,
    "structurePoints": 2,
    "content": [
      {
        "type": "paragraph",
        "value": "A simple boat, powered by a small electric generator and able to transport up to a dozen people across water"
      }
    ]
  },
  {
    "id": "36b2a94c-306f-476c-bf74-5c39a0eaab73",
    "source": "Reclamation of the Wastes",
    "page": 102,
    "name": "Tombstone Trackbox",
    "actions": ["Locomotion System", "Shanty Home"],
    "traits": [
      {
        "type": "personnel capacity",
        "amount": 12
      }
    ],
    "techLevel": 1,
    "salvageValue": 1,
    "structurePoints": 2,
    "content": [
      {
        "type": "paragraph",
        "value": "A caravan home built on the frame of an industrial trackbox."
      }
    ]
  },
  {
    "id": "79640c87-2166-44fa-a9e5-396de3fe865a",
    "source": "Salvage Union Workshop Manual",
    "name": "Machine Gun Turret",
    "actions": [".50 Cal Machine Gun"],
    "traits": [
      {
        "type": "immobile"
      }
    ],
    "techLevel": 1,
    "salvageValue": 1,
    "structurePoints": 2,
    "page": 293,
    "additionalSources": [{ "source": "Reclamation of the Wastes", "page": 103 }],
    "content": [
      {
        "type": "paragraph",
        "value": "A static gun emplacement."
      }
    ]
  },
  {
    "id": "ab26df6f-cc65-492d-9d80-42c31489c4a7",
    "source": "Reclamation of the Wastes",
    "page": 103,
    "name": "Green Laser Turret",
    "actions": ["Green Laser"],
    "traits": [
      {
        "type": "immobile"
      }
    ],
    "techLevel": 2,
    "salvageValue": 1,
    "structurePoints": 4
  },
  {
    "id": "73ffb42f-ab96-4a15-bd48-ab86ab79a47d",
    "source": "Reclamation of the Wastes",
    "page": 103,
    "name": "Missile Pod Turret",
    "actions": ["Missile Pod"],
    "traits": [
      {
        "type": "immobile"
      }
    ],
    "techLevel": 3,
    "salvageValue": 1,
    "structurePoints": 6
  }
]
